{
  "schemaVersion": "v1.0",
  "patchId": "PATCH-20260215-ABC123",
  "runId": "RUN-20260215-ABC123",
  "baseSnapshotDigest": "blake3:0000000000000000000000000000000000000000000000000000000000000000",
  "policyPackRef": "POLICY-STRICT-ENG-v1",
  "configRef": "CFG-PROD-v3",
  "operations": [
    {
      "opId": "OP-0001",
      "opType": "ADD_MILESTONE",
      "phase": 1,
      "entityType": "MILESTONE",
      "entityId": "MILE-BEDROCK",
      "path": "/",
      "value": {
        "schemaVersion": "v1.0",
        "id": "MILE-BEDROCK",
        "title": "Bedrock Foundations",
        "status": "ACTIVE"
      },
      "precondition": {
        "exists": false,
        "expectedHash": "blake3:0000000000000000000000000000000000000000000000000000000000000000"
      },
      "invertibility": {
        "inverseOpType": "DELETE_MILESTONE",
        "inversePath": "/",
        "inverseValue": null,
        "inversePreconditionHash": "blake3:0000000000000000000000000000000000000000000000000000000000000000"
      },
      "rationale": "Initial milestone for foundational work"
    }
  ],
  "rollbackOperations": [
    {
      "opId": "OP-0002",
      "revertsOpId": "OP-0001",
      "opType": "DELETE_MILESTONE",
      "phase": 1,
      "entityType": "MILESTONE",
      "entityId": "MILE-BEDROCK",
      "path": "/",
      "value": null,
      "precondition": {
        "exists": true,
        "expectedHash": "blake3:0000000000000000000000000000000000000000000000000000000000000000"
      },
      "invertibility": {
        "inverseOpType": "ADD_MILESTONE",
        "inversePath": "/",
        "inverseValue": {
          "schemaVersion": "v1.0",
          "id": "MILE-BEDROCK",
          "title": "Bedrock Foundations",
          "status": "ACTIVE"
        },
        "inversePreconditionHash": "blake3:0000000000000000000000000000000000000000000000000000000000000000"
      },
      "rationale": "Rollback for initial milestone"
    }
  ],
  "approvals": {
    "required": false,
    "satisfied": true,
    "approverIds": [],
    "approvalRef": "AUTO-APPROVED"
  },
  "metadata": {
    "createdAt": "2026-02-15T00:00:00.000Z",
    "author": {
      "type": "agent",
      "id": "agent:test"
    },
    "rationale": "Bootstrap the roadmap with initial milestone",
    "idempotencyKey": "create-fixture@1.0.0|schema:bc88a424a25aaff3|key:de2eb399202bbb91"
  },
  "signature": {
    "alg": "ed25519",
    "keyId": "did:key:z6MkgyWT7Dk9yQuYTDLa2Zg5SiN4D5YWoCTWQ3MVb2hg5212",
    "payloadDigest": "blake3:bd2be7485f2d0b386620b4360d3496e961bac024863b7d4b0d17ff6e6fd122bb",
    "sig": "6464f6f17e848662b3f841fbc8b908c4ffb2310ddfca16d887a4ebc2472b4428bf92fb85b1b561e02e56f662d1527b584cd4234f1b9cef3cee02c4362f2a1a05"
  }
}